{
  "robustness_report_version": "1.0",
  "strategy_id": "dividend_defense_smallcap_5d",
  "created_at": "2026-09-14T12:18:44.531889+00:00",
  "input_binding": {
    "config_csv_sha256": "9f0ebe9ab273e25e7e6b793dbe4e898ee724dcdd77d2a9738127a9183bbc4333",
    "daily_stats_csv_sha256": "3f7b986f1426a03378649cc656e72db4bb98ff5e399667ed50713e66d590cb76",
    "trades_csv_sha256": "965c5bdde78ef57439ec0b84eca5ccac6da63c0258a2d0110bdb8d3f38a0d773",
    "primary_result_dir": "D:\\miniQMT策略实盘\\QuantStudio\\agent_workspace\\dividend_defense_smallcap_5d\\evidence_g35\\g35_run1"
  },
  "window": {
    "start": "2020-01-02",
    "end": "2026-07-31",
    "trading_days": 1594,
    "benchmark_source": "daily_stats_benchmark_column"
  },
  "wf": {
    "folds": [
      {
        "fold_index": 1,
        "fold_window": {
          "start": "2020-01-02",
          "end": "2021-04-27"
        },
        "trade_days": 319,
        "round_trips": 104,
        "no_trade_flag": false,
        "strategy_return": 0.27966088820603097,
        "benchmark_return": 0.22596959713311393,
        "excess_return": 0.053691291072917036,
        "positive": true,
        "artifacts": {
          "config_csv_sha256": "1132462f29f28f8251b8dc50191eeb062ca334c0f1adb8c00fa9833fffd20a95",
          "daily_stats_csv_sha256": "ff2e6c9b82cb5c748e3024dacea78264a6dfbd3ade5204104923bfd45c79a053",
          "trades_csv_sha256": "0000000000000000000000000000000000000000000000000000000000000000",
          "round_trips_csv_sha256": "c55a58e11c73abeed6c0dc18724e1e38ee2c237546434b734a0da06cdb08654b",
          "result_dir": "D:\\miniQMT策略实盘\\QuantStudio\\output\\backtest_results\\20260914_153601_r55_fold1"
        }
      },
      {
        "fold_index": 2,
        "fold_window": {
          "start": "2021-04-28",
          "end": "2022-08-18"
        },
        "trade_days": 319,
        "round_trips": 109,
        "no_trade_flag": false,
        "strategy_return": 0.5810567435645742,
        "benchmark_return": -0.1834530125565511,
        "excess_return": 0.7645097561211253,
        "positive": true,
        "artifacts": {
          "config_csv_sha256": "5b7750934e2991af280cfe3d39419bb423b1f96571d9936ab5fe5aa6e7fc8895",
          "daily_stats_csv_sha256": "fa6a269a7147636a48124183e372a5816a698bdcb6660c5bced9018ba68bafd7",
          "trades_csv_sha256": "0000000000000000000000000000000000000000000000000000000000000000",
          "round_trips_csv_sha256": "f823f20a47870c123f543289e8d2ff33899def8327436d7bc4b70968d5bba9e1",
          "result_dir": "D:\\miniQMT策略实盘\\QuantStudio\\output\\backtest_results\\20260914_162422_r55_fold2"
        }
      },
      {
        "fold_index": 3,
        "fold_window": {
          "start": "2022-08-19",
          "end": "2023-12-12"
        },
        "trade_days": 319,
        "round_trips": 96,
        "no_trade_flag": false,
        "strategy_return": 0.13541352625753067,
        "benchmark_return": -0.17447790569660337,
        "excess_return": 0.30989143195413404,
        "positive": true,
        "artifacts": {
          "config_csv_sha256": "149d01dca424a5744ff8c47a083bf9b73ffe0f6bb2a282f72f0a8602c37a64e8",
          "daily_stats_csv_sha256": "b7c4ae738a183e94e47b2b934ac5890d127a9eaeb38b0190e73fe6b361311639",
          "trades_csv_sha256": "0000000000000000000000000000000000000000000000000000000000000000",
          "round_trips_csv_sha256": "8396470ec16716377298400a97a112b80369cf98e92feb4c127a31c145fb3495",
          "result_dir": "D:\\miniQMT策略实盘\\QuantStudio\\output\\backtest_results\\20260914_172045_r55_fold3"
        }
      },
      {
        "fold_index": 4,
        "fold_window": {
          "start": "2023-12-13",
          "end": "2025-04-10"
        },
        "trade_days": 319,
        "round_trips": 106,
        "no_trade_flag": false,
        "strategy_return": -0.10498851168218004,
        "benchmark_return": 0.10847578347578302,
        "excess_return": -0.21346429515796306,
        "positive": false,
        "artifacts": {
          "config_csv_sha256": "20df9f0d0ec903e2bfda8d7325013d5e02bee336336f96ee6e004c85236daf04",
          "daily_stats_csv_sha256": "e7608bd867654622668f74c4f493faa8424f7cbb2cbb2a5441f6c05a853e2343",
          "trades_csv_sha256": "0000000000000000000000000000000000000000000000000000000000000000",
          "round_trips_csv_sha256": "c8f9123fccdec29bb671d1b4bbf52051b9c4344cf5e36f1ff1059f8518106087",
          "result_dir": "D:\\miniQMT策略实盘\\QuantStudio\\output\\backtest_results\\20260914_181532_r55_fold4"
        }
      },
      {
        "fold_index": 5,
        "fold_window": {
          "start": "2025-04-11",
          "end": "2026-07-31"
        },
        "trade_days": 318,
        "round_trips": 109,
        "no_trade_flag": false,
        "strategy_return": 0.3479109197295083,
        "benchmark_return": 0.2233503620831241,
        "excess_return": 0.12456055764638418,
        "positive": true,
        "artifacts": {
          "config_csv_sha256": "573e3fe1fba54bbf12f972810b2784853a69d0846572233394085ecc5d9cacbc",
          "daily_stats_csv_sha256": "c9b33180da24b7c6bcc143a25a57dbaf09da108afc4ad48b68dc3caeeabe2bb0",
          "trades_csv_sha256": "0000000000000000000000000000000000000000000000000000000000000000",
          "round_trips_csv_sha256": "e103b34964e40df345c06f44732d6d7d8484f969e2ca9ac04c25513ff5ee7372",
          "result_dir": "D:\\miniQMT策略实盘\\QuantStudio\\output\\backtest_results\\20260914_191541_r55_fold5"
        }
      }
    ],
    "valid_folds": 5,
    "positive_folds": 4,
    "positive_ratio": 0.8,
    "skipped": false,
    "skip_reason": null
  },
  "mc": {
    "n": 1000,
    "block_length": 21,
    "method": "stationary_block_bootstrap_on_excess_daily_returns",
    "p_value": 0.005994005994005994,
    "observed_mean_excess": 0.0011226519922149386,
    "null_quantiles": {
      "q05": 0.0004618176218849514,
      "q50": 0.0011085931158256314,
      "q95": 0.0017560165442163757
    }
  },
  "gates": {
    "G1": {
      "result": "PASS",
      "value": 0.32124720682547814,
      "threshold": 0.0,
      "dimension": "absolute",
      "detail": ""
    },
    "G2": {
      "result": "FAIL",
      "value": -0.2723356154764156,
      "threshold": -0.25,
      "dimension": "absolute",
      "detail": ""
    },
    "G3": {
      "result": "PASS",
      "value": 1.1502841146574727,
      "threshold": 0.5,
      "dimension": "absolute",
      "detail": ""
    },
    "G4": {
      "result": "PASS",
      "value": 0.5811051693404634,
      "threshold": 0.4,
      "dimension": "trade_level",
      "detail": "round_trips=561"
    },
    "G5": {
      "result": "PASS",
      "value": 0.8,
      "threshold": 0.6,
      "dimension": "fold_level",
      "detail": "4/5 valid folds positive"
    },
    "G6": {
      "result": "PASS",
      "value": 0.005994005994005994,
      "threshold": 0.01,
      "dimension": "excess",
      "detail": ""
    }
  },
  "overall": "FAILED",
  "iteration": {
    "iteration_count": 0,
    "terminal": false
  },
  "seeds": {
    "mc_seed_source": "sha256(trades_csv+config_csv)[:8]",
    "mc_seed_hex": "40d1cbca",
    "python_hashseed": null
  }
}